{
  "$schema": "http://json-schema.org/draft-07/schema#",
  "type": "object",
  "additionalProperties": true,
  "required": ["schema_version", "user", "exercise_outcomes"],
  "properties": {
    "schema_version": { "type": "string", "const": "session_log_entry.v1" },
    "logged_at": { "type": "string" },
    "user": {
      "type": "object",
      "additionalProperties": true,
      "required": ["id"],
      "properties": {
        "id": { "type": "string", "minLength": 1 },
        "name": { "type": ["string", "null"] },
        "bodyweight_kg": { "type": ["number", "null"] }
      }
    },
    "session": { "type": "object", "additionalProperties": true },
    "context": { "type": "object", "additionalProperties": true },
    "exercise_outcomes": {
      "type": "array",
      "minItems": 1,
      "items": { "$ref": "exercise_outcome.v1.json" }
    }
  }
}
